财政部、农业部关于全面推开农业“三项补贴”改革工作的通知,财政部 农业部(已撤销) 机构沿革,2016.04.18,财农〔2016〕26号,财政部、农业部关于全面推开农业“三项补贴”改革工作的通知     制定机关： 财政部 农业部(已撤销) 机构沿革  发文字号：财农〔2016〕26号   公布日期：2016.04.18   施行日期：2016.04.18   时效性： 现行有效   效力位阶： 部门工作文件   法规类别： 财政综合规定 农业管理     财政部、农业部关于全面推开农业“三项补贴”改革工作的通知（财农〔2016〕26号）  各省、自治区、直辖市、计划单列市财政厅（局）、农业（农牧、农村经济）厅（局、委员会）：  2015年，经国务院同意，财政部、农业部印发了《关于调整完善农业三项补贴政策的指导意见》（财农〔2015〕31号），在全国范围内从农资综合补贴中调整20%的资金，加上种粮大户补贴试点资金和农业“三项补贴”增量资金，统筹用于支持粮食适度规模经营，重点用于支持建立完善农业信贷担保体系，同时选择部分省开展试点，将农作物良种补贴、种粮农民直接补贴和农资综合补贴合并为农业支持保护补贴，政策目标调整为支持耕地地力保护和粮食适度规模经营。\  （二）有利于促进粮食适度规模经营。\当前农业虽然保持增量增收的好势头，但数量与质量、总量与结构、投入与产出、成本与效益、生产与环境等方面矛盾日益上升，特别是家庭小规模经营仍占大多数，一定程度上限制了农业劳动生产率的提高，影响了农业现代化进程。\通过政策引导，加快培育新型经营主体、培养新型职业农民，鼓励多种形式的粮食适度规模经营，有利于推动农业生产加快进入规模化、产业化、社会化发展新阶段，符合现代农业发展方向。\     二、主要内容  2016年起，在全国全面推开农业“三项补贴”改革，即将农业“三项补贴”合并为农业支持保护补贴，政策目标调整为支持耕地地力保护和粮食适度规模经营。\中央财政已将2016年用于耕地地力保护的农业支持保护补贴资金全部提前下达，其中下达黑龙江省、广东省和新疆维吾尔自治区的资金，包含了需兑付给直属垦区农场和兵团团场职工的用于耕地地力保护的资金，由农业部直属垦区、新疆生产建设兵团商当地省级财政、农业部门研究落实；年度执行中下达的农业支持保护补贴资金全部用于支持粮食适度规模经营；中央财政通过上划部门预算下达农业部直属垦区、新疆生产建设兵团、中储粮总公司的农业支持保护补贴资金，全部用于支持粮食适度规模经营。\  （二）促进粮食适度规模经营。\用于粮食适度规模经营的补贴资金，原则上以2016年的规模为基数，每年从农业支持保护补贴资金中予以安排，以后年度根据农业支持保护补贴的预算安排情况同比例调整，支持对象重点向种粮大户、家庭农场、农民合作社和农业社会化服务组织等新型经营主体倾斜，体现“谁多种粮食，就优先支持谁”。\鼓励各地创新新型经营主体支持方式，采取贷款贴息、重大技术推广与服务补助等方式支持新型经营主体发展多种形式的粮食适度规模经营，不鼓励对新型经营主体采取现金直补。\  近几年，用于粮食适度规模经营的补贴资金，要按照财政部、农业部、银监会印发的《关于财政支持建立农业信贷担保体系的指导意见》（财农〔2015〕121号）要求，重点支持建立健全农业信贷担保体系，中央财政下达地方用于支持粮食适度规模经营的农业支持保护补贴资金统筹用于资本金注入、担保费用补助、风险补偿等方面，通过强化银担合作机制，着力解决新型经营主体在粮食适度规模经营中的“融资难、融资贵”问题，力争用3年时间建成政策性、独立性、专注于农业、覆盖全国的农业信贷担保体系。\各地要充分发挥财政注入资本金的作用，尽快启动农业信贷担保业务运营，并根据业务开展情况，合理确定财政注入资本金的规模和节奏。\中央财政农业支持保护补贴资金按照耕地面积、粮食产量、适度规模经营发展等因素测算切块到省级财政，由各省份结合本地实际确定补贴对象、补贴方式和补贴标准。,用于粮食适度规模经营的补贴资金，原则上以2016年的规模为基数，每年从农业支持保护补贴资金中予以安排，以后年度根据农业支持保护补贴的预算安排情况同比例调整，支持对象重点向种粮大户、家庭农场、农民合作社和农业社会化服务组织等新型经营主体倾斜，体现“谁多种粮食，就优先支持谁”。
国务院关于激发重点群体活力带动城乡居民增收的实施意见,国务院,2016.10.10,国发〔2016〕56号,  到2020年，城镇就业规模逐步扩大，劳动生产率不断提高，就业质量稳步提升；城乡居民人均收入比2010年翻一番；宏观收入分配格局持续优化，居民可支配收入占国内生产总值（GDP）的比重继续提高；居民内部收入差距持续缩小，中等收入者比重上升，现行标准下农村贫困人口全部实现脱贫，共建共享的格局初步形成。\积极培育家庭农场、专业大户、农民合作社、农业企业等新型农业经营主体和农业社会化服务主体，发展适度规模经营。,积极培育家庭农场、专业大户、农民合作社、农业企业等新型农业经营主体和农业社会化服务主体，发展适度规模经营。
国务院关于印发全国农业现代化规划(2016—2020年)的通知,国务院,2016.10.17,国发〔2016〕58号,适度规模经营呈现新局面。\以土地制度、经营制度、产权制度、支持保护制度为重点的农村改革深入推进，家庭经营、合作经营、集体经营、企业经营共同发展，多种形式的适度规模经营比重明显上升。\农业基础设施加快改善，农产品供给充裕，农民发展规模经营主动性不断增强，为农业现代化提供不竭源动力。\     二、指导思想  全面贯彻党的十八大和十八届三中、四中、五中全会精神，深入贯彻习近平总书记系列重要讲话精神，按照“五位一体”总体布局和“四个全面”战略布局，牢固树立创新、协调、绿色、开放、共享的发展理念，认真落实党中央、国务院决策部署，以提高质量效益和竞争力为中心，以推进农业供给侧结构性改革为主线，以多种形式适度规模经营为引领，加快转变农业发展方式，构建现代农业产业体系、生产体系、经营体系，保障农产品有效供给、农民持续增收和农业可持续发展，走产出高效、产品安全、资源节约、环境友好的农业现代化发展道路，为实现“四化”同步发展和如期全面建成小康社会奠定坚实基础。\引导农村剩余劳动力有序向城镇转移，积极发展小城镇，加快农业转移人口市民化进程，为发展多种形式适度规模经营、提高农业质量效益、实现农业现代化创造条件。\   专栏1 “十三五”农业现代化主要指标              类别  指  标  2015年 基期值  2020年 目标值  年均增速 〔累计〕  指标属性    粮食供给保障  粮食（谷物）综合生产能力（亿吨）  5  5.5  〔0.5〕  约束性      小麦稻谷自给率（%）  100  100  -  约束性    农业结构  玉米种植面积（亿亩）  5.7  5  〔-0.7〕  预期性      大豆种植面积（亿亩）  0.98  1.4  〔0.42〕  预期性      棉花种植面积（万亩）  5698  5000  〔-698〕  预期性      油料种植面积（亿亩）  2.1  2  〔-0.1〕  预期性      糖料种植面积（万亩）  2610  2400  〔-210〕  预期性      肉类产量（万吨）  8625  9000  0.85%  预期性      奶类产量（万吨）  3870  4100  1.16%  预期性      水产品产量（万吨）  6699  6600  -0.3%  预期性      畜牧业产值占农业总产值比重（%）  28  ＞30  〔＞2〕  预期性      渔业总产值占农业总产值比重（%）  10  ＞10  -  预期性      农产品加工业与农业总产值比  2.2  2.4  〔0.2〕  预期性    质量效益  农业劳动生产率（万元/人）  3  ＞4.7  ＞9.4%  预期性      农村居民人均可支配收入增幅（%）  -  -  ＞6.5  预期性      农产品质量安全例行监测总体合格率（%）  97  ＞97  -  预期性    可持续发展  耕地保有量（亿亩）  18.65  18.65  -  约束性      草原综合植被盖度（%）  54  56  〔2〕  约束性      农田灌溉水有效利用系数  0.532  ＞0.55  〔＞0.018〕  预期性      主要农作物化肥利用率（%）  35.2  40  〔4.8〕  约束性      主要农作物农药利用率（%）  36.6  40  〔3.4〕  约束性      农膜回收率（%）  60  80  〔20〕  约束性      养殖废弃物综合利用率（%）  60  75  〔15〕  约束性    技术装备  农田有效灌溉面积（亿亩）  9.88  ＞10  〔＞0.12〕  预期性      农业科技进步贡献率（%）  56  60  〔4〕  预期性      农作物耕种收综合机械化率（%）  63  70  〔7〕  预期性    规模经营  多种形式土地适度规模经营占比（%）  30  40  〔10〕  预期性      畜禽养殖规模化率（%）  54  65  〔11〕  预期性      水产健康养殖示范面积比重（%）  45  65  〔20〕  预期性    支持保护  全国公共财政农林水事务支出总额（亿元）  17380  ＞17380  -  预期性      农业保险深度（%）  0.62  0.9  〔0.28〕  预期性    备注：1.小麦稻谷自给率是指小麦稻谷国内生产能力满足需求的程度。\在棉花、油料、糖料、蚕桑优势产区建设一批规模化、标准化生产基地。\统筹考虑种养规模和资源环境承载力，推进以生猪和草食畜牧业为重点的畜牧业结构调整，形成规模化生产、集约化经营为主导的产业发展格局，在畜牧业主产省（区）率先实现现代化。\统筹布局渔业发展空间，合理确定湖泊和水库等公共水域养殖规模，稳定池塘养殖，推进稻田综合种养和低洼盐碱地养殖。\优先将水土资源匹配较好、相对集中连片的稻谷小麦田划定为粮食生产功能区，对大豆、棉花、糖料蔗等重要农产品划定生产保护区，明确保有规模，加大建设力度，实行重点保护。\（国家发展改革委、国土资源部、农业部牵头，财政部、环境保护部、水利部、国家统计局、国家粮食局等部门参与）  （二）大规模推进高标准农田建设。\健全县乡农村经营管理体系，加强土地流转和规模经营的管理服务。\（中央农办、农业部牵头，国家发展改革委、财政部、人力资源社会保障部、国土资源部、国务院法制办等部门参与）  （二）积极发展多种形式适度规模经营。\支持通过土地流转、土地托管、土地入股等多种形式发展适度规模经营，加强典型经验总结和推广。\加快建立新型经营主体支持政策体系，扩大新型经营主体承担涉农项目规模，建立新型经营主体生产经营信息直报制度。\实施农业社会化服务支撑工程，扩大农业生产全程社会化服务创新试点和政府购买公益性服务机制创新试点范围，推进代耕代种、病虫害统防统治等服务的专业化、规模化、社会化。\  以粮食主产区为重点，优先建设确保口粮安全的高标准农田，开展农田灌排设施、机耕道路、农田林网、输配电设施、农机具存放设施和土壤改良等田间工程建设，大规模改造中低产田，到2020年确保建成8亿亩、力争完成10亿亩集中连片、旱涝保收、稳产高产、生态友好的高标准农田。\  开展畜禽规模养殖场（小区）、水产养殖场和屠宰场标准化改造，改善养殖和屠宰加工条件，完善粪污处理等设施，推进循环利用。\以畜禽规模养殖场为重点，建设大型沼气工程、生物质燃气提纯利用及有机肥加工设施，发展以沼气为纽带的生态循环农业。\合理控制地下水开发利用强度较大的三江平原地区水稻种植规模，适当减少高纬度区玉米种植面积，增加食用大豆生产。\适度扩大生猪、奶牛、肉牛生产规模。\稳定生猪、奶牛、肉牛肉羊养殖规模，发展净水渔业。\控制水网密集区生猪、奶牛养殖规模，适度开发草山草坡资源发展草食畜牧业，大力发展名优水产品生产。\稳定水稻面积，扩大南菜北运基地和热带作物产业规模。\对农业资源环境问题突出的区域，重点加快调整农业结构，限制资源消耗大的产业规模，稳步推进农业现代化。\扩大甘肃玉米良种繁育基地规模，稳定新疆优质棉花种植面积，稳步发展设施蔬菜和特色园艺。\发展适度规模草食畜牧业，推进冷水鱼类资源开发利用。\调减籽粒玉米种植面积，扩大青贮玉米和优质牧草生产规模，发展奶牛和肉牛肉羊养殖。\稳定青稞、马铃薯、油菜发展规模，推行禁牧休牧轮牧和舍饲半舍饲，发展牦牛、藏系绵羊、绒山羊等特色畜牧业。\控制近海养殖规模，拓展外海养殖空间。\扩大海洋牧场立体养殖、深水网箱养殖规模，建设海洋渔业优势产业带。\强化农业产业化龙头企业联农带农激励机制，带动农户发展适度规模经营，带动农民合作社、家庭农场开拓市场。\改善农产品初加工、深加工、休闲农业和乡村旅游设施条件，建设规模化、标准化原料生产基地及农产品加工技术集成基地，打造1500个“一村一品”示范村镇。\继续推进退牧还草、退耕还草、草原防灾减灾和鼠虫草害防治等重大工程，建设人工草场和节水灌溉饲草料基地，扩大舍饲圈养规模。\促进渔业资源永续利用，扩大水生生物增殖放流规模，建设人工鱼礁、海洋牧场。\扩大黑土地保护利用试点规模，在重金属污染区、地下水漏斗区、生态严重退化地区实行耕地轮作休耕制度试点。\创建农业标准化示范区，深入推进园艺作物、畜禽水产养殖、屠宰标准化创建，基本实现全国“菜篮子”产品生产大县规模种养基地生产过程标准化、规范化。\发展节水农业，加快实施东北节水增粮、西北节水增效、华北节水压采、南方节水减排等区域规模化高效节水灌溉工程，新增高效节水灌溉面积1亿亩。\  选择一批特色鲜明、技术先进、优势明显的农产品出口大县，建设一批规模化、标准化生产基地，培育一批精通国际规则、出口规模大的龙头企业。\支持有意愿、有实力、带动能力强的新型经营主体，扩大优势特色产业发展规模，与贫困户建立稳定的带动关系。\实施支持农业转移人口市民化若干财政政策，建立城镇建设用地增加规模同吸纳农业转移人口落户数量挂钩机制，实现1亿左右农业转移人口和其他常住人口在城镇定居落户。\  支持农民依托特色产业增收、规模经营增收、加工增值增收、功能拓展增收、节本降耗增收、转移就业增收，重点加大对低收入农户的支持，确保2020年农民收入比2010年翻一番。\逐步扩大“绿箱”补贴规模和范围，调整改进“黄箱”政策。\开展粮食生产规模经营主体营销贷款试点，推行农业保险保单质押贷款。\（保监会、财政部、农业部牵头，国家发展改革委、人民银行、中国气象局、证监会等部门参与）     三、完善农业用地政策  新型经营主体用于经营性畜禽养殖、工厂化作物栽培、水产养殖以及规模化粮食生产的生产设施、附属设施和配套设施的用地，可按设施农用地管理。\支持新型经营主体将集中连片整理后新增加的部分耕地，按规定用于完善规模经营配套设施。\改革完善重要农产品储备管理体制，推进政策性职能和经营性职能相分离，科学确定储备规模，完善吞吐调节机制。,以产业为依托，发展农业产业化，建设一批农村一二三产业融合先导区和农业产业化示范基地，推动农民合作社、家庭农场与龙头企业、配套服务组织集群集聚。\培育发展家庭农场，提升农民合作社规范化水平，鼓励发展农民合作社联合社，落实财政补助形成的资产转交合作社持有和管护政策。\强化农业产业化龙头企业联农带农激励机制，带动农户发展适度规模经营，带动农民合作社、家庭农场开拓市场。\实施农民工等人员返乡创业行动计划，开展百万乡村旅游创客行动，引导有志投身现代农业建设的农村青年、返乡农民工、农村大中专毕业生创办领办家庭农场、农民合作社和农业企业。\  创建示范家庭农场、农民合作社示范社、产业化示范基地、社会化服务示范组织。\落实家庭农场、农民合作社、农业产业化龙头企业生产档案记录和休药期制度。
中共中央办公厅、国务院办公厅关于完善农村土地所有权承包权经营权分置办法的意见,中共中央办公厅 国务院办公厅 机构沿革,2016.10.30, ,“三权分置”是农村基本经营制度的自我完善，符合生产关系适应生产力发展的客观规律，展现了农村基本经营制度的持久活力，有利于明晰土地产权关系，更好地维护农民集体、承包农户、经营主体的权益；有利于促进土地资源合理利用，构建新型农业经营体系，发展多种形式适度规模经营，提高土地产出率、劳动生产率和资源利用率，推动现代农业发展。\全面贯彻党的十八大和十八届三中、四中、五中全会精神，深入学习贯彻习近平总书记系列重要讲话精神，紧紧围绕统筹推进“五位一体”总体布局和协调推进“四个全面”战略布局，牢固树立新发展理念，认真落实党中央、国务院决策部署，围绕正确处理农民和土地关系这一改革主线，科学界定“三权”内涵、权利边界及相互关系，逐步建立规范高效的“三权”运行机制，不断健全归属清晰、权能完整、流转顺畅、保护严格的农村土地产权制度，优化土地资源配置，培育新型经营主体，促进适度规模经营发展，进一步巩固和完善农村基本经营制度，为发展现代农业、增加农民收入、建设社会主义新农村提供坚实保障。\完善工商资本租赁农地监管和风险防范机制，严格准入门槛，确保土地经营权规范有序流转，更好地与城镇化进程和农村劳动力转移规模相适应，与农业科技进步和生产手段改进程度相适应，与农业社会化服务水平相适应。\引导新型经营主体与承包农户建立紧密利益联结机制，带动普通农户分享农业规模经营收益。,积极创建示范家庭农场、农民专业合作社示范社、农业产业化示范基地、农业示范服务组织，加快培育新型经营主体。\支持新型经营主体相互融合，鼓励家庭农场、农民专业合作社、农业产业化龙头企业等联合与合作，依法组建行业组织或联盟。\认真研究农村集体经济组织、家庭农场发展等相关法律问题。
国务院办公厅关于完善支持政策促进农民持续增收的若干意见,国务院办公厅 机构沿革,2016.11.24,国办发〔2016〕87号,大规模推进高标准农田建设和农村土地整治，加强农田水利、农业科技和粮食仓储物流等基础设施建设，实施山水林田湖生态保护和修复工程。\落实和完善农业“三项补贴”改革政策，重点支持耕地地力保护和粮食适度规模经营。\建设现代饲草料产业体系，合理布局畜禽、水产养殖，推进标准化、规模化生产。\探索开展粮食生产规模经营主体营销贷款改革试点。\工商资本投资建设高标准农田、生态公益林等连片面积达到一定规模的，允许在符合土地管理法律法规和土地利用总体规划、依法办理建设用地审批手续、坚持节约集约用地的前提下，利用一定比例的土地开展观光和休闲度假旅游、农产品加工流通等经营活动。\鼓励工商企业投资适合产业化、规模化、集约化经营的农业领域，积极发展现代种养业和农业多种经营。,完善财税、信贷、保险、用地、项目支持等政策，培育发展家庭农场、专业大户、农民合作社、农业产业化龙头企业等新型农业经营主体。
中共中央、国务院关于落实发展新理念加快农业现代化实现全面小康目标的若干意见,中国共产党中央委员会 国务院,2015.12.31,中发〔2016〕1号,  1．大规模推进高标准农田建设。\  2．大规模推进农田水利建设。\大力开展区域规模化高效节水灌溉行动，积极推广先进适用节水灌溉技术。\扩大开发性金融支持水利工程建设的规模和范围。\  5．发挥多种形式农业适度规模经营引领作用。\坚持以农户家庭经营为基础，支持新型农业经营主体和新型农业服务主体成为建设现代农业的骨干力量，充分发挥多种形式适度规模经营在农业机械和科技成果应用、绿色发展、市场开拓等方面的引领功能。\完善财税、信贷保险、用地用电、项目支持等政策，加快形成培育新型农业经营主体的政策体系，进一步发挥财政资金引导作用，撬动规模化经营主体增加生产性投入。\探索开展粮食生产规模经营主体营销贷款改革试点。\支持多种类型的新型农业服务主体开展代耕代种、联耕联种、土地托管等专业化规模化服务。\健全县乡农村经营管理体系，加强对土地流转和规模经营的管理服务。\加快现代畜牧业建设，根据环境容量调整区域养殖布局，优化畜禽养殖结构，发展草食畜牧业，形成规模化生产、集约化经营为主导的产业发展格局。\实行建设用地总量和强度双控行动，严格控制农村集体建设用地规模。\实施耕地质量保护与提升行动，加强耕地质量调查评价与监测，扩大东北黑土地保护利用试点规模。\扩大新一轮退耕还林还草规模。\开展大规模国土绿化行动，增加森林面积和蓄积量。\继续推进农业标准化示范区、园艺作物标准园、标准化规模养殖场（小区）、水产健康养殖场建设。\加快实现所有具备条件的乡镇和建制村通硬化路、通班车，推动一定人口规模的自然村通公路。\发展农村规模化沼气。\全面改善贫困地区义务教育薄弱学校基本办学条件，改善农村学校寄宿条件，办好乡村小规模学校，推进学校标准化建设。\健全农村劳动力转移就业服务体系，大力促进就地就近转移就业创业，稳定并扩大外出农民工规模，支持农民工返乡创业。\健全财政转移支付同农业转移人口市民化挂钩机制，建立城镇建设用地增加规模同吸纳农业转移人口落户数量挂钩机制。\科学确定粮食等重要农产品国家储备规模，完善吞吐调节机制。,积极培育家庭农场、专业大户、农民合作社、农业产业化龙头企业等新型农业经营主体。
