中共中央办公厅、国务院办公厅印发《关于引导农村土地经营权有序流转发展农业适度规模经营的意见》,中共中央办公厅 国务院办公厅 机构沿革,2014.11.20, ,中共中央办公厅、国务院办公厅印发《关于引导农村土地经营权有序流转发展农业适度规模经营的意见》     制定机关： 中共中央办公厅 国务院办公厅 机构沿革  公布日期：2014.11.20   施行日期：2014.11.20   时效性： 现行有效   效力位阶： 党内法规制度   法规类别： 农村经济体制改革     中共中央办公厅、国务院办公厅印发《关于引导农村土地经营权有序流转发展农业适度规模经营的意见》（2014年11月20日）    伴随我国工业化、信息化、城镇化和农业现代化进程，农村劳动力大量转移，农业物质技术装备水平不断提高，农户承包土地的经营权流转明显加快，发展适度规模经营已成为必然趋势。\实践证明，土地流转和适度规模经营是发展现代农业的必由之路，有利于优化土地资源配置和提高劳动生产率，有利于保障粮食安全和主要农产品供给，有利于促进农业技术推广应用和农业增效、农民增收，应从我国人多地少、农村情况千差万别的实际出发，积极稳妥地推进。\为引导农村土地（指承包耕地）经营权有序流转、发展农业适度规模经营，现提出如下意见。\全面理解、准确把握中央关于全面深化农村改革的精神，按照加快构建以农户家庭经营为基础、合作与联合为纽带、社会化服务为支撑的立体式复合型现代农业经营体系和走生产技术先进、经营规模适度、市场竞争力强、生态环境可持续的中国特色新型农业现代化道路的要求，以保障国家粮食安全、促进农业增效和农民增收为目标，坚持农村土地集体所有，实现所有权、承包权、经营权三权分置，引导土地经营权有序流转，坚持家庭经营的基础性地位，积极培育新型经营主体，发展多种形式的适度规模经营，巩固和完善农村基本经营制度。\改革的方向要明，步子要稳，既要加大政策扶持力度，加强典型示范引导，鼓励创新农业经营体制机制，又要因地制宜、循序渐进，不能搞大跃进，不能搞强迫命令，不能搞行政瞎指挥，使农业适度规模经营发展与城镇化进程和农村劳动力转移规模相适应，与农业科技进步和生产手段改进程度相适应，与农业社会化服务水平提高相适应，让农民成为土地流转和规模经营的积极参与者和真正受益者，避免走弯路。\  --坚持经营规模适度，既要注重提升土地经营规模，又要防止土地过度集中，兼顾效率与公平，不断提高劳动生产率、土地产出率和资源利用率，确保农地农用，重点支持发展粮食规模化生产。\建立健全承包合同取得权利、登记记载权利、证书证明权利的土地承包经营权登记制度，是稳定农村土地承包关系、促进土地经营权流转、发展适度规模经营的重要基础性工作。\  （八）合理确定土地经营规模。\各地要依据自然经济条件、农村劳动力转移情况、农业机械化水平等因素，研究确定本地区土地规模经营的适宜标准。\防止脱离实际、违背农民意愿，片面追求超大规模经营的倾向。\现阶段，对土地经营规模相当于当地户均承包地面积10至15倍、务农收入相当于当地二三产业务工收入的，应当给予重点扶持。\创新规模经营方式，在引导土地资源适度集聚的同时，通过农民的合作与联合、开展社会化服务等多种形式，提升农业规模化经营水平。\  （九）扶持粮食规模化生产。\加大粮食生产支持力度，原有粮食直接补贴、良种补贴、农资综合补贴归属由承包农户与流入方协商确定，新增部分应向粮食生产规模经营主体倾斜。\对从事粮食规模化生产的农民合作社、家庭农场等经营主体，符合申报农机购置补贴条件的，要优先安排。\探索选择运行规范的粮食生产规模经营主体开展目标价格保险试点。\抓紧开展粮食生产规模经营主体营销贷款试点，允许用粮食作物、生产及配套辅助设施进行抵押融资。\粮食品种保险要逐步实现粮食生产规模经营主体愿保尽保，并适当提高对产粮大县稻谷、小麦、玉米三大粮食品种保险的保费补贴比例。\各地区各有关部门要研究制定相应配套办法，更好地为粮食生产规模经营主体提供支持服务。\重点培育以家庭成员为主要劳动力、以农业为主要收入来源，从事专业化、集约化农业生产的家庭农场，使之成为引领适度规模经营、发展现代农业的有生力量。\鼓励各地整合涉农资金建设连片高标准农田，并优先流向家庭农场、专业大户等规模经营农户。\有条件的地方根据农民意愿，可以统一连片整理耕地，将土地折股量化、确权到户，经营所得收益按股分配，也可以引导农民以承包地入股组建土地股份合作组织，通过自营或委托经营等方式发展农业规模经营。\鼓励农业产业化龙头企业等涉农企业重点从事农产品加工流通和农业社会化服务，带动农户和农民合作社发展规模经营。\引导工商资本发展良种种苗繁育、高标准设施农业、规模化养殖等适合企业化经营的现代种养业，开发农村“四荒”资源发展多种经营。\鼓励地方扩大对家庭农场、专业大户、农民合作社、龙头企业、农业社会化服务组织的扶持资金规模。\综合运用货币和财税政策工具，引导金融机构建立健全针对新型农业经营主体的信贷、保险支持机制，创新金融产品和服务，加大信贷支持力度，分散规模经营风险。\鼓励农技推广、动植物防疫、农产品质量安全监管等公共服务机构围绕发展农业适度规模经营拓展服务范围。\积极推广既不改变农户承包关系，又保证地有人种的托管服务模式，鼓励种粮大户、农机大户和农机合作社开展全程托管或主要生产环节托管，实现统一耕作，规模化生产。\实施新型职业农民培育工程，围绕主导产业开展农业技能和经营能力培养培训，扩大农村实用人才带头人示范培养培训规模，加大对专业大户、家庭农场经营者、农民合作社带头人、农业企业经营管理人员、农业社会化服务人员和返乡农民工的培养培训力度，把青年农民纳入国家实用人才培养计划。\鼓励基层供销合作社针对农业生产重要环节，与农民签订服务协议，开展合作式、订单式服务，提高服务规模化水平。\各级党委和政府要充分认识引导农村土地经营权有序流转、发展农业适度规模经营的重要性、复杂性和长期性，切实加强组织领导，严格按照中央政策和国家法律法规办事，及时查处违纪违法行为。\各有关部门要按照职责分工，抓紧修订完善相关法律法规，建立工作指导和检查监督制度，健全齐抓共管的工作机制，引导农村土地经营权有序流转，促进农业适度规模经营健康发展。,对从事粮食规模化生产的农民合作社、家庭农场等经营主体，符合申报农机购置补贴条件的，要优先安排。\重点培育以家庭成员为主要劳动力、以农业为主要收入来源，从事专业化、集约化农业生产的家庭农场，使之成为引领适度规模经营、发展现代农业的有生力量。\分级建立示范家庭农场名录，健全管理服务制度，加强示范引导。\鼓励各地整合涉农资金建设连片高标准农田，并优先流向家庭农场、专业大户等规模经营农户。\鼓励地方扩大对家庭农场、专业大户、农民合作社、龙头企业、农业社会化服务组织的扶持资金规模。\实施新型职业农民培育工程，围绕主导产业开展农业技能和经营能力培养培训，扩大农村实用人才带头人示范培养培训规模，加大对专业大户、家庭农场经营者、农民合作社带头人、农业企业经营管理人员、农业社会化服务人员和返乡农民工的培养培训力度，把青年农民纳入国家实用人才培养计划。
国务院关于推进新农村建设工作情况的报告,国务院,2014.12.23, ,大规模开展高标准农田建设，到2020年建成集中连片、旱涝保收的高标准农田8亿亩。\推进规模化集中供水和城镇供水管网向农村延伸，加快解决农村饮水安全问题。\加快构建现代农业新型经营体系，大力扶持家庭农场、专业大户、农民合作社、农业产业化龙头企业等新型农业经营主体，探索政府向经营性服务组织购买农业公益性服务机制，引导土地有序流转，发展多种形式的适度规模经营。,加快构建现代农业新型经营体系，大力扶持家庭农场、专业大户、农民合作社、农业产业化龙头企业等新型农业经营主体，探索政府向经营性服务组织购买农业公益性服务机制，引导土地有序流转，发展多种形式的适度规模经营。
中共中央、国务院印发《关于全面深化农村改革加快推进农业现代化的若干意见》,中国共产党中央委员会 国务院,2014.01.19,中发〔2014〕1号,要以解决好地怎么种为导向加快构建新型农业经营体系，以解决好地少水缺的资源环境约束为导向深入推进农业发展方式转变，以满足吃得好吃得安全为导向大力发展优质安全农产品，努力走出一条生产技术先进、经营规模适度、市场竞争力强、生态环境可持续的中国特色新型农业现代化道路。\2014年，启动东北和内蒙古大豆、新疆棉花目标价格补贴试点，探索粮食、生猪等农产品目标价格保险试点，开展粮食生产规模经营主体营销贷款试点。\科学确定重要农产品储备功能和规模，强化地方尤其是主销区的储备责任，优化区域布局和品种结构。\严格农业投入品管理，大力开展园艺作物标准园、畜禽规模化养殖、水产健康养殖等创建活动。\分区域规模化推进高效节水灌溉行动。\加大农业面源污染防治力度，支持高效肥和低残留农药使用、规模养殖场畜禽粪便资源化利用、新型农业经营主体使用有机肥、推广高标准农膜和残膜回收等试点。\     五、构建新型农业经营体系  21．发展多种形式规模经营。\土地流转和适度规模经营要尊重农民意愿，不能强制推动。\因地制宜发展户用沼气和规模化沼气。,按照自愿原则开展家庭农场登记。
农业部关于扎实做好2015年农业农村经济工作的意见,农业部(已撤销) 机构沿革,2015.01.16,农发〔2015〕1号,继续开展园艺作物标准园创建，加快推进都市现代农业和新一轮“菜篮子”工程建设，扩大北方城市冬季设施蔬菜生产试点规模。\构建粮饲兼顾、农牧结合、循环发展的新型种养结构，加快推进规模化、集约化、标准化养殖。\加大对生猪、奶牛、肉牛、肉羊标准化规模养殖场（小区）建设支持力度，在冀鲁豫皖等地重点实施基础母牛扩群增量项目。\优化草食畜牧业区域布局，草原牧区重点推行划区轮牧、舍饲半舍饲，北方农牧交错带重点推广农牧户繁育、规模场育肥，传统养牛养羊大省重点发展农牧结合的标准化适度规模养殖，南方实施现代草地畜牧业推进行动。\加快建立农产品标准化生产体系，重点支持中小规模生产经营主体改善基础设施生产条件，提升标准化生产水平。\大力发展名特优新农产品，扩大无公害农产品、绿色食品、有机农产品和地理标志农产品生产规模，打造一批农业标准化生产基地。\继续实施种子工程，推进国家级育种制种基地建设，加快海南南繁基地保护区土地确权，提高甘肃、四川制种基地的规模化、标准化、机械化、集约化水平。\加快发展农机服务组织，培养职业型农机实用人才，拓展农机作业服务市场，发挥农机合作社和农机大户在农业规模经营和先进技术推广中的作用。\继续实施国家物联网应用示范和农业物联网区域试验工程，研发运行国家物联网公共服务平台，强化设施园艺、规模养殖、农业资源环境监测、农产品质量安全追溯、节本增效等示范应用。\完善休禁渔制度，扩大水生生物资源增殖放流规模，加强人工鱼礁和海洋牧场建设，促进渔业资源养护。\     六、扎实推进农村改革，激发农业农村发展活力  26.引导土地经营权有序流转，发展适度规模经营。\贯彻落实中办国办《关于引导农村土地经营权有序流转发展农业适度规模经营的意见》，创新土地流转和规模经营方式，积极探索适度规模经营的多种有效形式。\抓好《农业部关于促进家庭农场发展的指导意见》贯彻落实，做好家庭农场发展情况监测工作，鼓励发展规模适度的农户家庭农场，完善对粮食生产规模经营主体的支持服务体系。\发挥农垦独特优势，推进资源资产整合、产业优化升级，积极培育规模化农业经营主体，加快现代农业建设，把农垦建成重要农产品生产供应基地和现代农业示范带动力量。\要廉政勤政，坚持从严治党，狠抓党风廉政建设“两个责任”落实，坚持不懈纠正“四风”、改进作风，深入推进政风行风建设，上下联动做好教育实践活动整改工作，继续深入开展“为农民服务”活动，以好的状态、好的作风、好的业绩，努力推动农业农村经济发展再上新台阶，为经济社会发展全局作出新的更大贡献！   农业部2015年1月16日      本篇引用的法规   中央法规   中共中央办公厅、国务院办公厅印发《关于引导农村土地经营权有序流转发展农业适度规模经营的意见》   国务院办公厅关于建立病死畜禽无害化处理机制的意见   农业部、国家发展和改革委员会、财政部等关于引导和促进农民合作社规范发展的意见   农业部关于促进家庭农场发展的指导意见   中华人民共和国农村土地承包经营权证管理办法   引用本篇的法规 案例 论文   部门规章   农业部办公厅关于扎实推进主食加工业提升行动的通知   农业部办公厅关于印发《2015年农村经营管理工作要点》的通知   农业部办公厅关于开展2015年农产品加工业区域经济合作有关活动的通知   农业部办公厅关于贯彻落实2015年农业农村经济工作重要举措分工的通知   农业部办公厅关于切实做好2015年农垦农业生产工作的通知   地方法规规章   甘肃省农牧厅办公室关于组织参加第18届中国农产品加工业投资贸易洽谈会的通知     ©北大法宝：（www.pkulaw.com）专业提供法律信息、法学知识和法律软件领域各类解决方案。,抓好《农业部关于促进家庭农场发展的指导意见》贯彻落实，做好家庭农场发展情况监测工作，鼓励发展规模适度的农户家庭农场，完善对粮食生产规模经营主体的支持服务体系。\推进新型农业经营主体和新型职业农民“两新”融合、一体发展，扩大新型职业农民培育工程示范范围，在专业大户、家庭农场、农民合作社、龙头企业设立新型职业农民培训课堂、实训和创业基地。\要廉政勤政，坚持从严治党，狠抓党风廉政建设“两个责任”落实，坚持不懈纠正“四风”、改进作风，深入推进政风行风建设，上下联动做好教育实践活动整改工作，继续深入开展“为农民服务”活动，以好的状态、好的作风、好的业绩，努力推动农业农村经济发展再上新台阶，为经济社会发展全局作出新的更大贡献！   农业部2015年1月16日      本篇引用的法规   中央法规   中共中央办公厅、国务院办公厅印发《关于引导农村土地经营权有序流转发展农业适度规模经营的意见》   国务院办公厅关于建立病死畜禽无害化处理机制的意见   农业部、国家发展和改革委员会、财政部等关于引导和促进农民合作社规范发展的意见   农业部关于促进家庭农场发展的指导意见   中华人民共和国农村土地承包经营权证管理办法   引用本篇的法规 案例 论文   部门规章   农业部办公厅关于扎实推进主食加工业提升行动的通知   农业部办公厅关于印发《2015年农村经营管理工作要点》的通知   农业部办公厅关于开展2015年农产品加工业区域经济合作有关活动的通知   农业部办公厅关于贯彻落实2015年农业农村经济工作重要举措分工的通知   农业部办公厅关于切实做好2015年农垦农业生产工作的通知   地方法规规章   甘肃省农牧厅办公室关于组织参加第18届中国农产品加工业投资贸易洽谈会的通知     ©北大法宝：（www.pkulaw.com）专业提供法律信息、法学知识和法律软件领域各类解决方案。
农业部关于进一步调整优化农业结构的指导意见,农业部(已撤销) 机构沿革,2015.01.30,农发〔2015〕2号,着眼于稳定面积和提高地力，加快划定永久基本农田，大规模建设旱涝保收、高产稳产的高标准农田，大幅度提升耕地质量，将粮食产能落实到田头地块，实现“藏粮于地”。\着眼于提高单产和提升品质，加快新品种繁育，大规模开展高产创建和绿色增产模式攻关，集成推广应用综合技术，健全农业科技创新、农技推广的激励机制，力争在种业等关键领域取得突破，实现“藏粮于技”。\着眼于调动农民种粮储粮积极性和提升农民素质，完善粮食生产支持保护政策体系，保证农民种粮合理收益；改善生产经营者的储粮条件，保持和扩大新型农业经营主体粮食烘干和储备规模，减少粮食产后损失；加快培育新型农业经营主体，造就一支适应现代农业发展的高素质职业农民队伍，实现“藏粮于民”。\东北地区要提升口粮生产能力，在地下水开采较重的三江平原地区合理控制水稻种植面积，加强节水灌溉设施建设和节水技术推广，与水库和灌渠建设相配套，改井灌为渠灌，保护地下水资源；推广粮豆轮作，适当减少高纬度区玉米种植面积，扩大大豆种植面积；在农牧交错带，积极推广农牧结合、粮草兼顾、生态循环种养模式，大力发展优质高产奶业和肉牛肉羊产业，推广种养专业户和家庭牧场繁育、规模场标准化育肥。\稳定生猪、肉禽、蛋禽、牛羊养殖规模。\退减重金属重度污染区的水稻种植面积，发展棉麻、花卉等非食用农产品，调整重金属中轻度污染区水稻种植、发展低积累品种作物和豆科牧草等培肥地力作物种植；推进畜禽养殖适度规模化，在人口密集区适当减少生猪养殖规模，发挥水资源优势大力发展名优水产品生产。\加快发展循环农业，根据资源承载力和农业废弃物消纳半径，合理布局规模化养殖场，配套建设有机肥生产设施，积极发展资源利用节约化、生产过程清洁化、废弃物利用资源化等生态循环农业模式，大力推广绿肥种植，因地制宜推广稻田养鱼（虾、蟹）、鱼菜共生等技术。\建设一批专业化、规模化、标准化的原料生产基地，完善利益联结机制，促进专用原料基地与龙头企业、农产品加工园区、物流配送营销体系紧密衔接。\大力推进标准化生产，继续推进园艺作物标准园、畜禽标准化规模养殖场和水产健康养殖场建设，积极发展“三品一标”农产品。\用好奶牛、肉牛、肉羊标准化规模养殖场建设资金，示范建设一批农牧渔结合、循环生态的园艺作物标准园和标准化规模养殖场，引导循环农业发展。\加强新型农业经营主体培育，通过贴息贷款、项目支持等方式，支持种养大户、家庭农场、农民合作社、龙头企业等发展适度规模种养业、生态循环农业。,加强新型农业经营主体培育，通过贴息贷款、项目支持等方式，支持种养大户、家庭农场、农民合作社、龙头企业等发展适度规模种养业、生态循环农业。
第十二届全国人民代表大会第三次会议关于2014年国民经济和社会发展计划执行情况与2015年国民经济和社会发展计划的决议,全国人民代表大会,2015.03.15, ,跨境贸易和投资人民币结算规模增大。\高技术制造业增加值增长12.3%，比规模以上工业快4个百分点。\国家新型城镇化规划及户籍制度改革、“三个1亿人”实施方案等配套政策出台实施，包括2个省和62个城市（镇）的国家新型城镇化综合试点启动，城市规模划分标准优化调整。\外贸进出口总额增长6%左右，一般贸易、服务贸易比重提高，利用外资规模大体稳定，对外直接投资保持较快增长。\开展农村土地经营权抵押贷款试点，引导农民以土地经营权入股合作社和龙头企业，推进多种形式适度规模经营。\健全耕地保护、粮食主产区利益等补偿机制，做好适度规模种粮大户、家庭农场和其他新型经营主体补贴试点。\统筹粮棉油糖蔬菜等生产基地建设，推进规模化、集约化、标准化畜禽水产养殖。\扩大科技成果转化引导基金规模。\支持和发展新型农业经营主体，推进多种形式的适度规模经营。,健全耕地保护、粮食主产区利益等补偿机制，做好适度规模种粮大户、家庭农场和其他新型经营主体补贴试点。
